{
  "$schema": "http://json-schema.org/draft-07/schema#",
  "$id": "https://clawrocket.dev/contracts/editorial-room/v0/voice.schema.json",
  "title": "VoicePageCompiledTruth",
  "description": "Voice page compiled_truth (loose). See EDITORIAL_ROOM_CONTRACT.md §3.4. The contract requires only that the page exists at the slug referenced in SetupState.voice_page_slug; what matters is the prose content (loaded as system context for every Skill call). Schema is intentionally permissive — we lock down the slug + body fields and allow forward-compatible additions.",
  "type": "object",
  "additionalProperties": true,
  "required": ["schema_version", "slug", "name", "body_md"],
  "properties": {
    "schema_version": { "const": "0" },
    "slug": {
      "type": "string",
      "minLength": 1,
      "description": "e.g., 'voice/gamemakers-2026'."
    },
    "name": { "type": "string", "minLength": 1 },
    "body_md": {
      "type": "string",
      "minLength": 1,
      "maxLength": 16384,
      "description": "Prose voice spec in Markdown. §7 cap: 16 KB."
    }
  }
}
